Wikipedia,290,289,625896,Noticed your nice ''<url>'' photograph. Perhaps you were on the Siruvani bird survey ?,,,,,,0,,,3,,,,,,3,,4,,,-2,,,,,2,4,,-1,,,,,0,,,,,,3,,,,4,,1,,,,5,,,2,,,,,,0.088396628,,,0.383069845,,,,,,0.519064519,,0.529359829,,,-0.713637631,,,,,-0.191809178,0.609712315,,-0.329909859,,,,,-0.739529715,,,,,,0.624353352,,,,0.891568231,,0.264630782,,,,0.977858094,,,0.135766986,0,0,-1,-1
Wikipedia,291,290,237733,"The problem remains that I don't know where to turn to educate myself further on the matter. For instance, where would I find the Tao-Green paper you mention in the article?",,,3,,,,8,,,,,,,-3,,,,5,,,,,9,,,3,2,,9,,,,,0,,,,,,6,,,,8,,,,-6,,0,,,,,0.961153917,,,,2.592729439,,,,,,,-0.58160984,,,,1.492204355,,,,,1.166151801,,,0.158073563,0.121034193,,1.622628537,,,,,-0.139064134,,,,,,0.809263499,,,,0.936069999,,,,-0.863472248,,-0.249489407,,,0,0,-1,-1
Wikipedia,292,291,266502,I saw that page but was not sure if it had anything to do with any of the articles we are working on? or was this a general issue?,,,3,,,,-3,,,,,,,-4,,,,1,,,,,2,,,4,2,,8,,,,,-9,,,,,,-3,,,,9,,,,-3,,0,,,,,0.961153917,,,,-1.318528831,,,,,,,-0.80638659,,,,0.180376351,,,,,0.163010467,,,0.609712315,0.121034193,,1.366086476,,,,,-2.462470757,,,,,,-0.943997719,,,,1.184859367,,,,-0.427191533,,-0.249489407,,,0,0,-1,-1
Wikipedia,293,292,115921,"<name>, you didn't reply to my message and my email. One question: if the church was built after 1700 but later ruin, for instance ruined by Beria order in 30s, can it be considered Contemporary?",,,-2,,,,-6,,,,,,,-4,,,,-3,,,,,-11,,,1,-10,,-2,,,,,-3,,,,,,-8,,,,9,,,,-6,,-5,,,,,-1.000384689,,,,-2.385235631,,,,,,,-0.80638659,,,,-1.131451654,,,,,-1.699966297,,,-0.745203941,-2.404896789,,-1.199334136,,,,,-0.913533008,,,,,,-1.918031729,,,,1.184859367,,,,-0.863472248,,-3.468707558,,,0,0,-1,-1
Wikipedia,294,293,249702,"Hi <name> - I've been noticing your sig on WP:CFD... this is probably something you know all about but... you do know about being able to use four tildes (<nowiki>~~~~</nowiki>) to sign, don't you? Or have you done some fancy trick with your signature to stop it linking back to your user page?",,,1,,,,0,,,,,,,-2,,,,-1,,,,,-1,,,2,6,,-1,,,,,,,,,,,-8,,,,7,,,,-8,,-2,,,,,0.176538475,,,,-0.25182203,,,,,,,-0.356833091,,,,-0.475537652,,,,,-0.266907248,,,-0.293565189,0.963011187,,-0.942792075,,,,,,,,,,,-1.918031729,,,,0.68728063,,,,-1.154326058,,-1.537176667,,,0,0,-1,-1
Wikipedia,295,294,431249,Hi. Is there any chance of getting <url> unblocked from making edits on Wikipedia?,,,2,,,,4,,,,,,,7,,,,0,,,,,7,,,3,0,,9,,,,,3,,,,,,6,,,,4,,,,0,,0,,,,,0.568846196,,,,1.170453704,,,,,,,1.666157659,,,,-0.14758065,,,,,0.879539992,,,0.158073563,-0.299954304,,1.622628537,,,,,0.63540474,,,,,,0.809263499,,,,-0.059087475,,,,0.009089182,,-0.249489407,,,0,0,-1,-1
Wikipedia,296,295,620149,"- millions of people are using it to get help our service is free of charge. Since it's a tech support site you can't claim that it's not related to the article either (if you disagree with that just google for ""consumer electronics tech support"" see who comes first).We are here to server the community - why do you find it so offensive?",,,1,,,,-10,,,,,,,-6,,,,-2,,,,,2,,,2,0,,-3,,,,,-12,,,,,,-4,,,,8,,,,-3,,-1,,,,,0.176538475,,,,-3.807511366,,,,,,,-1.25594009,,,,-0.803494653,,,,,0.163010467,,,-0.293565189,-0.299954304,,-1.455876197,,,,,-3.236939632,,,,,,-1.138804521,,,,0.936069999,,,,-0.427191533,,-0.893333037,,,0,0,0,0
Wikipedia,297,296,396161,"Why am I never asked to write a feature. Is it because ""I is black""?",,,-6,,,,0,,,,,,,-9,,,,-2,,,,,-11,,,3,-5,,-2,,,,,-9,,,,,,-11,,,,7,,,,-11,,0,,,,,-2.569615575,,,,-0.25182203,,,,,,,-1.93027034,,,,-0.803494653,,,,,-1.699966297,,,0.158073563,-1.352425546,,-1.199334136,,,,,-2.462470757,,,,,,-2.502452135,,,,0.68728063,,,,-1.590606773,,-0.249489407,,,0,0,0,0
Wikipedia,298,297,628610,"I'm sorry, I'm having trouble understanding your question. Could you try again?",,,9,,,,12,,,,,,,10,,,,2,,,,,12,,,3,12,,12,,,,,9,,,,,,12,,,,7,,,,12,,3,,,,,3.315000245,,,,4.015005173,,,,,,,2.340487909,,,,0.508333352,,,,,1.596069516,,,0.158073563,2.225976678,,2.39225472,,,,,2.184342489,,,,,,1.978104311,,,,0.68728063,,,,1.754212041,,1.682041484,,,0,0,-1,-1
Wikipedia,299,298,259765,I put plural women because in the storylines it states he falls for Detective Graves. He also hits on another older woman <url> but that wasn't notable enough to include.. is it best to keep it singular?,,,4,,,,0,,,,,,,0,,,,0,,,,,8,,,2,0,,11,,,,,6,,,,,,,,,,8,,,,12,,0,,,,,1.353461639,,,,-0.25182203,,,,,,,0.092720409,,,,-0.14758065,,,,,1.022845897,,,-0.293565189,-0.299954304,,2.135712659,,,,,1.409873615,,,,,,,,,,0.936069999,,,,1.754212041,,-0.249489407,,,0,0,-1,-1
Wikipedia,300,299,144711,"So I got rid of it. Have a little faith in my good judgment, okay?",,,-6,,,,-9,,,,,,,-6,,,,-2,,,,,-12,,,3,-3,,-6,,,,,-12,,,,,,-7,,,,8,,,,-6,,-3,,,,,-2.569615575,,,,-3.451942432,,,,,,,-1.25594009,,,,-0.803494653,,,,,-1.843272202,,,0.158073563,-0.931437049,,-2.22550238,,,,,-3.236939632,,,,,,-1.723224927,,,,0.936069999,,,,-0.863472248,,-2.181020297,,,0,0,-1,-1
Wikipedia,1001,300,2320,Hmm...the picture was taken on my camera by someone else. To whom does the copyright belong?,9,0,1,1,3,3,2,,,,,,,,,,,,,,,,,,,,,,,,,2,8,1,,-6,10,11,1,,-5,,,,,,,,,,,,1.141269195,0.267533133,0.176538475,0.050180662,0.607261337,0.80630353,0.459315837,,,,,,,,,,,,,,,,,,,,,,,,,0.144446806,0.895468888,0.119092157,,-1.363207611,1.155016736,1.679891705,0.217797681,,-0.685706887,,,,,,,,,,,,0,0,-1,-1
Wikipedia,1002,301,4026,"My question is ""Why?"" I am doing all the citations correctly and this still appears often. Can anyone tell me what I'm doing wrong?",7,-2,-1,0,4,-7,1,,,,,,,,,,,,,,,,,,,,,,,,,-10,4,-2,,-3,4,6,-7,,-11,,,,,,,,,,,,0.833850634,-0.171066859,-0.608076968,-0.213267813,0.828191045,-1.586719476,0.103746904,,,,,,,,,,,,,,,,,,,,,,,,,-2.529438471,0.077969587,-0.655376717,,-0.7246072,-0.361416615,0.614844085,-1.408425004,,-1.605360829,,,,,,,,,,,,0,0,-1,-1
Wikipedia,1003,302,4767,I noticed you removed Pero Defformero from the list of folk metal bands and artists. What is the problem with this band?,-4,-3,0,0,-4,2,1,,,,,,,,,,,,,,,,,,,,,,,,,1,6,-3,,-9,7,4,9,,-11,,,,,,,,,,,,-0.856951451,-0.390366855,-0.215769247,-0.213267813,-0.93924662,0.567001229,0.103746904,,,,,,,,,,,,,,,,,,,,,,,,,-0.078376967,0.486719237,-0.913533008,,-2.001808021,0.39680006,0.188825037,1.844020366,,-1.605360829,,,,,,,,,,,,0,0,0,0
Wikipedia,1004,303,5692,I don't see a connection between the 'url' and the 'url' articles that would warrant See Also links between the two.  Could you explain that to me?,0,-1,1,3,4,1,0,,,,,,,,,,,,,,,,,,,,,,,,,-2,6,7,,4,1,4,0,,-5,,,,,,,,,,,,-0.242114329,0.048233137,0.176538475,0.577077613,0.828191045,0.327698929,-0.25182203,,,,,,,,,,,,,,,,,,,,,,,,,-0.746848286,0.486719237,1.668029906,,0.765460425,-1.119633291,0.188825037,0.014519845,,-0.685706887,,,,,,,,,,,,0,0,-1,-1
Wikipedia,1005,304,7122,url'.. it doesn't really explain what the issue was. Can you word it better?,-3,-3,-1,1,-4,-1,0,,,,,,,,,,,,,,,,,,,,,,,,,-4,4,-3,,-4,2,6,-4,,-4,,,,,,,,,,,,-0.70324217,-0.390366855,-0.608076968,0.050180662,-0.93924662,-0.150905672,-0.25182203,,,,,,,,,,,,,,,,,,,,,,,,,-1.192495832,0.077969587,-0.913533008,,-0.937474004,-0.866894399,0.614844085,-0.798591497,,-0.53243123,,,,,,,,,,,,0,0,-1,-1
Wikipedia,1006,305,17795,"Hello, Jeff79. Would you weigh in on the above linked discussion regarding an edit you made?",6,-1,1,1,3,4,1,,,,,,,,,,,,,,,,,,,,,,,,,4,8,2,,-1,2,,5,,4,,,,,,,,,,,,0.680141354,0.048233137,0.176538475,0.050180662,0.607261337,1.04560583,0.103746904,,,,,,,,,,,,,,,,,,,,,,,,,0.590094353,0.895468888,0.377248449,,-0.298873593,-0.866894399,,1.030909024,,0.693774027,,,,,,,,,,,,0,0,0,0
Wikipedia,1007,306,19520,Thanks for change to Hugh de Grandmesnil - I am (It is) very short of refs for that article. Could you suggest one for your addition?,7,,-1,2,1,1,0,,,,,,,,,,,,,,,,,,,,,,,,,4,7,8,,6,13,4,13,,6,,,,,,,,,,,,0.833850634,,-0.608076968,0.313629137,0.16540192,0.327698929,-0.25182203,,,,,,,,,,,,,,,,,,,,,,,,,0.590094353,0.691094062,1.926186198,,1.191194032,1.913233411,0.188825037,2.657131709,,1.000325341,,,,,,,,,,,,1,1,1,1
Wikipedia,1008,307,20833,"Darkstar, I am completely baffled by this, I don't know where you are coming from or what your complaint is, and you are one of the writers that I most often agree with. Can you explain?",-2,-6,-2,-1,-5,-8,0,,,,,,,,,,,,,,,,,,,,,,,,,-6,8,-2,,0,13,6,2,,-11,,,,,,,,,,,,-0.54953289,-1.048266844,-1.000384689,-0.476716289,-1.160176328,-1.826021776,-0.25182203,,,,,,,,,,,,,,,,,,,,,,,,,-1.638143378,0.895468888,-0.655376717,,-0.086006789,1.913233411,0.614844085,0.421075517,,-1.605360829,,,,,,,,,,,,0,0,1,1
Wikipedia,1009,308,21812,These clickable images are great! Can you make one for the 10^-6 to 10^5 range too?,10,4,3,2,3,4,2,,,,,,,,,,,,,,,,,,,,,,,,,1,11,-2,,3,1,7,0,,5,,,,,,,,,,,,1.294978475,1.144733118,0.961153917,0.313629137,0.607261337,1.04560583,0.459315837,,,,,,,,,,,,,,,,,,,,,,,,,-0.078376967,1.508593363,-0.655376717,,0.552593621,-1.119633291,0.827853609,0.014519845,,0.847049684,,,,,,,,,,,,0,0,-1,-1
Wikipedia,1010,309,21885,Interesting illustration on the PrIze law page of a Zeppelin taking a Norwegian vessel as a prize in 1917.  I wonder whether you could point me to a source for more information on this incident?,8,4,1,1,6,5,1,,,,,,,,,,,,,,,,,,,,,,,,,4,9,7,,-5,9,3,4,,-2,,,,,,,,,,,,0.987559915,1.144733118,0.176538475,0.050180662,1.270050461,1.284908131,0.103746904,,,,,,,,,,,,,,,,,,,,,,,,,0.590094353,1.099843713,1.668029906,,-1.150340807,0.902277844,-0.024184487,0.827631188,,-0.225879916,,,,,,,,,,,,0,0,-1,-1
Wikipedia,1011,310,25456,My concern is that you are proceeding at such a rate of knots that it going to be difficult to later unpick and I can see some disagreement on this.  Why not seek a consensus?,0,-5,1,0,0,-2,-1,,,,,,,,,,,,,,,,,,,,,,,,,0,6,-5,,-6,6,7,4,,-10,,,,,,,,,,,,-0.242114329,-0.828966848,0.176538475,-0.213267813,-0.055527788,-0.390207973,-0.607390963,,,,,,,,,,,,,,,,,,,,,,,,,-0.30120074,0.486719237,-1.429845591,,-1.363207611,0.144061168,0.827853609,0.827631188,,-1.452085172,,,,,,,,,,,,0,0,0,0
Wikipedia,1012,311,28354,url' is fooling around with the Rubinstein and Horowitz articles again.  Is there a way to get him banned?,0,-10,0,-4,-2,-4,0,,,,,,,,,,,,,,,,,,,,,,,,,-2,8,1,,4,8,4,3,,-11,,,,,,,,,,,,-0.242114329,-1.925466829,-0.215769247,-1.267061715,-0.497387204,-0.868812574,-0.25182203,,,,,,,,,,,,,,,,,,,,,,,,,-0.746848286,0.895468888,0.119092157,,0.765460425,0.649538952,0.188825037,0.624353352,,-1.605360829,,,,,,,,,,,,0,0,1,1
Wikipedia,1013,312,36851,"I'm curious, are you stopping at characters? Or will you eventually move onto season pages and the main page itself?",6,-3,1,1,1,4,-1,,,,,,,,,,,,,,,,,,,,,,,,,1,4,-1,,-3,12,12,-6,,-3,,,,,,,,,,,,0.680141354,-0.390366855,0.176538475,0.050180662,0.16540192,1.04560583,-0.607390963,,,,,,,,,,,,,,,,,,,,,,,,,-0.078376967,0.077969587,-0.397220426,,-0.7246072,1.660494519,1.89290123,-1.205147168,,-0.379155573,,,,,,,,,,,,0,0,0,0
Wikipedia,1014,313,39167,"Like most users with their articles screwed over by 'url''s new web facelift, I'm at a lost with 'url' being dead. Can you help?",6,-1,1,-2,4,-2,1,,,,,,,,,,,,,,,,,,,,,,,,,3,6,1,,-8,3,2,-3,,13,,,,,,,,,,,,0.680141354,0.048233137,0.176538475,-0.740164764,0.828191045,-0.390207973,0.103746904,,,,,,,,,,,,,,,,,,,,,,,,,0.367270579,0.486719237,0.119092157,,-1.788941218,-0.614155507,-0.237194012,-0.595313661,,2.07325494,,,,,,,,,,,,0,0,0,0
Wikipedia,1015,314,39531,Unfortunately the 4chan page you linked to in 'url' does not exist now. Can you give a pointer to what is involved?,7,0,2,1,2,3,0,,,,,,,,,,,,,,,,,,,,,,,,,1,7,0,,-9,5,7,5,,-8,,,,,,,,,,,,0.833850634,0.267533133,0.568846196,0.050180662,0.386331629,0.80630353,-0.25182203,,,,,,,,,,,,,,,,,,,,,,,,,-0.078376967,0.691094062,-0.139064134,,-2.001808021,-0.108677723,0.827853609,1.030909024,,-1.145533858,,,,,,,,,,,,0,0,-1,-1
Wikipedia,1016,315,39729,"Could you do me a huge favour, but only if you want to, because I know it's a lot to ask. Could you do the Peer Review for ''Loud'' by any chance?",13,2,2,4,2,6,1,,,,,,,,,,,,,,,,,,,,,,,,,10,11,5,6,,5,-2,,,13,,,,,,,,,,,,1.756106317,0.706133126,0.568846196,0.840526088,0.386331629,1.524210431,0.103746904,,,,,,,,,,,,,,,,,,,,,,,,,1.927036991,1.508593363,1.151717323,0.271892231,,-0.108677723,-1.089232108,,,2.07325494,,,,,,,,,,,,0,0,0,0
Wikipedia,1017,316,40728,"Hi, I was wondering why it is that 'url' only has two articles in it -- and whether it should be kept. Has it ever been more fully populated?",8,-1,2,2,6,2,1,,,,,,,,,,,,,,,,,,,,,,,,,1,11,1,3,,12,5,,,-1,,,,,,,,,,,,0.987559915,0.048233137,0.568846196,0.313629137,1.270050461,0.567001229,0.103746904,,,,,,,,,,,,,,,,,,,,,,,,,-0.078376967,1.508593363,0.119092157,-0.523792387,,1.660494519,0.401834561,,,-0.072604259,,,,,,,,,,,,0,0,0,0
Wikipedia,1018,317,43454,Good find. Do you have a cite for the second para?,11,2,1,3,5,11,3,,,,,,,,,,,,,,,,,,,,,,,,,3,6,2,5,,6,-2,,,2,,,,,,,,,,,,1.448687756,0.706133126,0.176538475,0.577077613,1.049120753,2.720721934,0.814884771,,,,,,,,,,,,,,,,,,,,,,,,,0.367270579,0.486719237,0.377248449,0.006664025,,0.144061168,-1.089232108,,,0.387222713,,,,,,,,,,,,0,1,1,1
Wikipedia,1019,318,45710,"Your 'url' give your first edit as on April 9, 2011. Do you have any other account you have not disclosed yet?",,-5,0,0,4,0,2,,,,,,,,,,,,,,,,,,,,,,,,,5,4,1,8,,10,-2,,,3,,,,,,,,,,,,,-0.828966848,-0.215769247,-0.213267813,0.828191045,0.088396628,0.459315837,,,,,,,,,,,,,,,,,,,,,,,,,0.812918126,0.077969587,0.119092157,0.802348643,,1.155016736,-1.089232108,,,0.54049837,,,,,,,,,,,,0,0,-1,-1
Wikipedia,1020,319,50455,I noticed that you have a little note at the top saying your status. How do you do that?,1,3,1,0,1,1,2,,,,,,,,,,,,,,,,,,,,,,,,,1,7,-2,3,,7,6,,,-8,,,,,,,,,,,,-0.088405049,0.925433122,0.176538475,-0.213267813,0.16540192,0.327698929,0.459315837,,,,,,,,,,,,,,,,,,,,,,,,,-0.078376967,0.691094062,-0.655376717,-0.523792387,,0.39680006,0.614844085,,,-1.145533858,,,,,,,,,,,,0,0,-1,-1
Wikipedia,1021,320,50905,I asked some questions in the Criteria for Inclusion section on 20th Dec but no-one has yet responded. Can you take a look?,2,2,0,1,3,-1,0,,,,,,,,,,,,,,,,,,,,,,,,,3,8,1,8,,5,7,,,-4,,,,,,,,,,,,0.065304232,0.706133126,-0.215769247,0.050180662,0.607261337,-0.150905672,-0.25182203,,,,,,,,,,,,,,,,,,,,,,,,,0.367270579,0.895468888,0.119092157,0.802348643,,-0.108677723,0.827853609,,,-0.53243123,,,,,,,,,,,,0,0,-1,-1
Wikipedia,1022,321,51534,I reverted 'url' as it complicated my normal routine archiving of all the discussions on my talk page.  Could you please refrain from this kind of edit in future?,-3,-7,-2,0,-5,2,1,,,,,,,,,,,,,,,,,,,,,,,,,1,7,5,9,,8,1,,,-2,,,,,,,,,,,,-0.70324217,-1.26756684,-1.000384689,-0.213267813,-1.160176328,0.567001229,0.103746904,,,,,,,,,,,,,,,,,,,,,,,,,-0.078376967,0.691094062,1.151717323,1.067576849,,0.649538952,-0.450203536,,,-0.225879916,,,,,,,,,,,,1,1,1,1
Wikipedia,1023,322,52673,I am trying to figure out the exact definition of 'url' however do not have access to Andrews.  Could you help?,8,0,0,1,-1,-2,3,,,,,,,,,,,,,,,,,,,,,,,,,2,12,6,5,,6,0,,,-3,,,,,,,,,,,,0.987559915,0.267533133,-0.215769247,0.050180662,-0.276457496,-0.390207973,0.814884771,,,,,,,,,,,,,,,,,,,,,,,,,0.144446806,1.712968189,1.409873615,0.006664025,,0.144061168,-0.66321306,,,-0.379155573,,,,,,,,,,,,0,0,-1,-1
Wikipedia,1024,323,60607,"The article is not about this, at all. Could you explain your logic?",-9,-6,2,-2,-2,-4,0,,,,,,,,,,,,,,,,,,,,,,,,,1,3,6,7,,8,2,,,-11,,,,,,,,,,,,-1.625497853,-1.048266844,0.568846196,-0.740164764,-0.497387204,-0.868812574,-0.25182203,,,,,,,,,,,,,,,,,,,,,,,,,-0.078376967,-0.126405239,1.409873615,0.537120437,,0.649538952,-0.237194012,,,-1.605360829,,,,,,,,,,,,0,0,-1,-1
Wikipedia,1025,324,66092,"Per 'url', there was an autoblock affecting your editing that has now been lifted.  Can you edit freely now?",13,0,0,2,2,1,3,,,,,,,,,,,,,,,,,,,,,,,,,1,5,1,5,,9,9,,,1,,,,,,,,,,,,1.756106317,0.267533133,-0.215769247,0.313629137,0.386331629,0.327698929,0.814884771,,,,,,,,,,,,,,,,,,,,,,,,,-0.078376967,0.282344412,0.119092157,0.006664025,,0.902277844,1.253872657,,,0.233947056,,,,,,,,,,,,0,0,-1,-1
Wikipedia,1026,325,69712,"You mean ""the higher solubility in the ocean""? Solubility of what?",4,-4,1,-4,-4,-6,0,,,,,,,,,,,,,,,,,,,,,,,,,0,2,-4,,,8,3,,,-4,,,,,,,,,,,,0.372722793,-0.609666852,0.176538475,-1.267061715,-0.93924662,-1.347417175,-0.25182203,,,,,,,,,,,,,,,,,,,,,,,,,-0.30120074,-0.330780064,-1.1716893,,,0.649538952,-0.024184487,,,-0.53243123,,,,,,,,,,,,0,0,-1,-1
Wikipedia,1027,326,70280,it is up on their website. Do you know how to put it on the south wales scorpions infobox thing on the wikipedia page?,4,-1,1,1,4,-2,2,,,,,,,,,,,,,,,,,,,,,,,,,1,3,2,1,,7,1,,,2,,,,,,,,,,,,0.372722793,0.048233137,0.176538475,0.050180662,0.828191045,-0.390207973,0.459315837,,,,,,,,,,,,,,,,,,,,,,,,,-0.078376967,-0.126405239,0.377248449,-1.054248798,,0.39680006,-0.450203536,,,0.387222713,,,,,,,,,,,,0,0,-1,-1
Wikipedia,1028,327,75904,I'm interested in why you reduced the columns from 5 to 2? Could you reply on my talk page please?,-4,-5,1,2,-3,2,0,,,,,,,,,,,,,,,,,,,,,,,,,2,5,5,10,,9,4,,,-2,,,,,,,,,,,,-0.856951451,-0.828966848,0.176538475,0.313629137,-0.718316912,0.567001229,-0.25182203,,,,,,,,,,,,,,,,,,,,,,,,,0.144446806,0.282344412,1.151717323,1.332805055,,0.902277844,0.188825037,,,-0.225879916,,,,,,,,,,,,1,1,-1,-1
Wikipedia,1029,328,79211,Is as usual being overrun with pointless blather. Would you like to set up a subpage to discuss sources?,-10,,0,-3,1,-3,0,,,,,,,,,,,,,,,,,,,,,,,,,1,1,4,5,,10,1,,,-2,,,,,,,,,,,,-1.779207134,,-0.215769247,-1.003613239,0.16540192,-0.629510273,-0.25182203,,,,,,,,,,,,,,,,,,,,,,,,,-0.078376967,-0.535154889,0.893561032,0.006664025,,1.155016736,-0.450203536,,,-0.225879916,,,,,,,,,,,,1,0,-1,-1
Wikipedia,1030,329,83428,"Sorry, but i do not find ""double torpedo tunnels"" to be very good. Can you come up with something better?",-5,-6,0,-2,-6,-1,1,,,,,,,,,,,,,,,,,,,,,,,,,1,6,-2,2,,2,-3,,,-1,,,,,,,,,,,,-1.010660731,-1.048266844,-0.215769247,-0.740164764,-1.381106036,-0.150905672,0.103746904,,,,,,,,,,,,,,,,,,,,,,,,,-0.078376967,0.486719237,-0.655376717,-0.789020592,,-0.866894399,-1.302241632,,,-0.072604259,,,,,,,,,,,,0,0,-1,-1
Wikipedia,1031,330,83786,"OK, I will do that. But probably we should first set the gallery up on commons - do you know anything about editing/creating there?",8,0,-2,1,-7,1,1,,,,,,,,,,,,,,,,,,,,,,,,,3,6,1,2,5,,8,,,,,,,,,,,,,,,0.987559915,0.267533133,-1.000384689,0.050180662,-1.602035744,0.327698929,0.103746904,,,,,,,,,,,,,,,,,,,,,,,,,0.367270579,0.486719237,0.119092157,-0.789020592,0.978327229,,1.040863133,,,,,,,,,,,,,,,0,0,-1,-1
Wikipedia,1032,331,83791,Why are you uploading/changing badge files here? Surely you should just upload them to Commons then list the wikipedia version for deletion?,-8,-8,0,-2,-6,-2,-6,,,,,,,,,,,,,,,,,,,,,,,,,-1,0,-2,1,6,,2,,,,,,,,,,,,,,,-1.471788573,-1.486866836,-0.215769247,-0.740164764,-1.381106036,-0.390207973,-2.385235631,,,,,,,,,,,,,,,,,,,,,,,,,-0.524024513,-0.739529715,-0.655376717,-1.054248798,1.191194032,,-0.237194012,,,,,,,,,,,,,,,1,0,-1,-1
Wikipedia,1033,332,85093,I have attempted to address your concern. Could you take another look at the article?,7,-2,-1,4,2,-2,4,,,,,,,,,,,,,,,,,,,,,,,,,7,2,-2,5,7,,6,,,,,,,,,,,,,,,0.833850634,-0.171066859,-0.608076968,0.840526088,0.386331629,-0.390207973,1.170453704,,,,,,,,,,,,,,,,,,,,,,,,,1.258565672,-0.330780064,-0.655376717,0.006664025,1.404060836,,0.614844085,,,,,,,,,,,,,,,0,0,0,0
Wikipedia,1034,333,85552,"I have no idea how to explain that succinctly, though I'll probably write a couple of articles on the whole mess soon. Any idea how to incorporate that into the article?",7,4,-1,-2,2,-2,5,,,,,,,,,,,,,,,,,,,,,,,,,1,4,1,6,6,,3,,,,,,,,,,,,,,,0.833850634,1.144733118,-0.608076968,-0.740164764,0.386331629,-0.390207973,1.526022638,,,,,,,,,,,,,,,,,,,,,,,,,-0.078376967,0.077969587,0.119092157,0.271892231,1.191194032,,-0.024184487,,,,,,,,,,,,,,,0,0,0,0
Wikipedia,1035,334,98588,The notion that a hunter would kill dozens of birds with a single shot seems outlandish to me.  Do you have a reference for this?,-6,-2,1,-2,-6,-2,1,,,,,,,,,,,,,,,,,,,,,,,,,-2,2,-1,5,3,,7,,,,,,,,,,,,,,,-1.164370012,-0.171066859,0.176538475,-0.740164764,-1.381106036,-0.390207973,0.103746904,,,,,,,,,,,,,,,,,,,,,,,,,-0.746848286,-0.330780064,-0.397220426,0.006664025,0.552593621,,0.827853609,,,,,,,,,,,,,,,1,0,-1,-1
Wikipedia,1036,335,98833,"I'm disappointed that your first response here was to revert me without discussion, and to assert a consensus that was not apparent.  Before you choose to revert me again, can you ''please'' participate in the discussion at WT:RD?",-10,-10,-4,-8,-7,3,-7,,,,,,,,,,,,,,,,,,,,,,,,,-11,-9,-1,10,-1,,10,,,,,,,,,,,,,,,-1.779207134,-1.925466829,-1.785000132,-2.320855616,-1.602035744,0.80630353,-2.740804565,,,,,,,,,,,,,,,,,,,,,,,,,-2.752262244,-2.578903142,-0.397220426,1.332805055,-0.298873593,,1.466882181,,,,,,,,,,,,,,,0,0,1,1
Wikipedia,1037,336,99444,Hello. Can you please pass the pilot whale article?,10,0,1,-2,3,0,4,,,,,,,,,,,,,,,,,,,,,,,,,4,4,1,8,9,,6,,,,,,,,,,,,,,,1.294978475,0.267533133,0.176538475,-0.740164764,0.607261337,0.088396628,1.170453704,,,,,,,,,,,,,,,,,,,,,,,,,0.590094353,0.077969587,0.119092157,0.802348643,1.829794443,,0.614844085,,,,,,,,,,,,,,,0,0,-1,-1
Wikipedia,1038,337,102052,"What you linked to looks good, but what was I supposed to compare it with again? Got a link?",4,0,0,-2,-2,0,2,,,,,,,,,,,,,,,,,,,,,,,,,2,3,1,10,5,,11,,,,,,,,,,,,,,,0.372722793,0.267533133,-0.215769247,-0.740164764,-0.497387204,0.088396628,0.459315837,,,,,,,,,,,,,,,,,,,,,,,,,0.144446806,-0.126405239,0.119092157,1.332805055,0.978327229,,1.679891705,,,,,,,,,,,,,,,1,0,-1,-1
Wikipedia,1039,338,105723,I noticed your nice improvements to 'url'. Are you thinking of merging/redirecting 'url' to that article?,8,3,3,5,2,-2,4,,,,,,,,,,,,,,,,,,,,,,,,,8,10,3,6,6,,2,,,,,,,,,,,,,,,0.987559915,0.925433122,0.961153917,1.103974563,0.386331629,-0.390207973,1.170453704,,,,,,,,,,,,,,,,,,,,,,,,,1.481389445,1.304218538,0.63540474,0.271892231,1.191194032,,-0.237194012,,,,,,,,,,,,,,,0,0,0,0
Wikipedia,1040,339,109287,"You are so right, 'url' looks to be blatant advertising.  Why don't you put it up for 'url'?",7,1,-2,0,6,6,1,,,,,,,,,,,,,,,,,,,,,,,,,2,6,0,2,6,,5,,,,,,,,,,,,,,,0.833850634,0.486833129,-1.000384689,-0.213267813,1.270050461,1.524210431,0.103746904,,,,,,,,,,,,,,,,,,,,,,,,,0.144446806,0.486719237,-0.139064134,-0.789020592,1.191194032,,0.401834561,,,,,,,,,,,,,,,0,0,-1,-1
Wikipedia,1041,340,109807,"Can you please explain what the two fields you added to the table at 'url' are supposed to mean?  What ""reaction""?",6,0,-1,1,-3,-2,-7,,,,,,,,,,,,,,,,,,,,,,,,,3,6,0,9,3,,4,,,,,,,,,,,,,,,0.680141354,0.267533133,-0.608076968,0.050180662,-0.718316912,-0.390207973,-2.740804565,,,,,,,,,,,,,,,,,,,,,,,,,0.367270579,0.486719237,-0.139064134,1.067576849,0.552593621,,0.188825037,,,,,,,,,,,,,,,1,0,1,1
Wikipedia,1042,341,110401,Have you received the 1972 Encyclopedia of PNG you mentioned during the discussion about 'url'? Was there a detailed entry for Dagora?,8,3,-1,-1,3,-3,,,,,,,,,,,,,,,,,,,,,,,,,,7,7,1,-1,5,,3,,,,,,,,,,,,,,,0.987559915,0.925433122,-0.608076968,-0.476716289,0.607261337,-0.629510273,,,,,,,,,,,,,,,,,,,,,,,,,,1.258565672,0.691094062,0.119092157,-1.58470521,0.978327229,,-0.024184487,,,,,,,,,,,,,,,0,0,0,0
Wikipedia,1043,342,119849,"I've noticed that you're engaged in several edit wars, with Meliniki, regarding minor alterations to multiple Greek language articles. Perhaps you should consider discussing the changes on Meliniki's 'url' instead?",-7,0,-5,0,-2,-3,1,,,,,,,,,,,,,,,,,,,,,,,,,10,5,0,5,4,,3,,,,,,,,,,,,,,,-1.318079292,0.267533133,-2.177307853,-0.213267813,-0.497387204,-0.629510273,0.103746904,,,,,,,,,,,,,,,,,,,,,,,,,1.927036991,0.282344412,-0.139064134,0.006664025,0.765460425,,-0.024184487,,,,,,,,,,,,,,,1,1,1,1
Wikipedia,1044,343,123039,"When creating 'url', I also had to create 'url', 'url' and 'url'. I was wondering if you could populate them?",6,-1,-1,0,2,6,3,,,,,,,,,,,,,,,,,,,,,,,,,4,5,4,5,3,,4,,,,,,,,,,,,,,,0.680141354,0.048233137,-0.608076968,-0.213267813,0.386331629,1.524210431,0.814884771,,,,,,,,,,,,,,,,,,,,,,,,,0.590094353,0.282344412,0.893561032,0.006664025,0.552593621,,0.188825037,,,,,,,,,,,,,,,0,0,0,0
Wikipedia,1045,344,123350,if i send email to permissions-en@wikimedia.org is the email made public? where is it made public?,9,1,0,-1,1,-3,-2,,,,,,,,,,,,,,,,,,,,,,,,,1,5,1,3,1,,2,,,,,,,,,,,,,,,1.141269195,0.486833129,-0.215769247,-0.476716289,0.16540192,-0.629510273,-0.962959897,,,,,,,,,,,,,,,,,,,,,,,,,-0.078376967,0.282344412,0.119092157,-0.523792387,0.126860014,,-0.237194012,,,,,,,,,,,,,,,0,0,0,0
Wikipedia,1046,345,123760,A question has come up whether 'url' was Jewish (see 'url').  Do you have any references that might help?,8,6,1,1,2,4,1,,,,,,,,,,,,,,,,,,,,,,,,,7,6,0,10,,,,,,,,,,,,,,,,,,0.987559915,1.58333311,0.176538475,0.050180662,0.386331629,1.04560583,0.103746904,,,,,,,,,,,,,,,,,,,,,,,,,1.258565672,0.486719237,-0.139064134,1.332805055,,,,,,,,,,,,,,,,,,0,0,-1,-1
Wikipedia,1047,346,125991,I wish I could find a better one but I don't think I know where one is I think the composition needs more information. Can you do that?,10,0,1,1,1,0,0,,,,,,,,,,,,,,,,,,,,,,,,,0,8,-2,5,,,,,,,,,,,,,,,,,,1.294978475,0.267533133,0.176538475,0.050180662,0.16540192,0.088396628,-0.25182203,,,,,,,,,,,,,,,,,,,,,,,,,-0.30120074,0.895468888,-0.655376717,0.006664025,,,,,,,,,,,,,,,,,,0,0,-1,-1
Wikipedia,1048,347,127846,"Listed by designation, new to me? have you a guideline or discussion reference for that?",4,,1,1,0,0,1,,,,,,,,,,,,,,,,,,,,,,,,,1,,-3,5,,,,,,,,,,,,,,,,,,0.372722793,,0.176538475,0.050180662,-0.055527788,0.088396628,0.103746904,,,,,,,,,,,,,,,,,,,,,,,,,-0.078376967,,-0.913533008,0.006664025,,,,,,,,,,,,,,,,,,0,0,-1,-1
