72,354587,"Sorry, what? Could you be more specific please?#",-1,,,,-2,,,5,,12,,,,3,-3,,,,,-6,,,,,1,,,,-2,,,,,4,,4,,,,,12,,3,,,,,2,,,-3,,,,-1,1,1,1,-1,1,1,1,1,1,1,1,1,1,-1,1,1,1,1,-1,1,1,1,1,1,1,1,1,-1,1,1,1,1,1,1,1,1,1,1,1,1,1,1,1,1,1,1,1,1,1,-1,1,1,1,0.777777778,0.677419355,0.913043478
73,134181,"I don't have the full list online, but I do have the 07-08 AJHL record book. Are there any specific seasons or teams you are looking for?#",0,,,,1,,,3,,12,,,,0,3,,,,,0,,,,,5,,,,5,,,,,7,,5,,,,,2,,3,,,,,0,,,4,,,,1,1,1,1,1,1,1,1,1,1,1,1,1,1,1,1,1,1,1,1,1,1,1,1,1,1,1,1,1,1,1,1,1,1,1,1,1,1,1,1,1,1,1,1,1,1,1,1,1,1,1,1,1,1,1,1,1
74,627256,How does it feel being wikifamous??#,0,,,,-2,,,6,,12,,,,-1,0,,,,,,,,,,-1,,,,0,,,,,-1,,-4,,,,,-8,,,,,,,0,,,-1,,,,1,1,1,1,-1,1,1,1,1,1,1,1,1,-1,1,1,1,1,1,1,1,1,1,1,-1,1,1,1,1,1,1,1,1,-1,1,-1,1,1,1,1,-1,1,1,1,1,1,1,1,1,1,-1,1,1,1,0.740740741,0.806451613,0.652173913
75,292274,You're welcome. What else is peer review for?#,10,,,,-1,,,8,,9,,,,8,9,,,,,-1,,,,,4,,,,-2,,,,,7,,1,,,,,11,,3,,,,,3,,,3,,,,1,1,1,1,-1,1,1,1,1,1,1,1,1,1,1,1,1,1,1,-1,1,1,1,1,1,1,1,1,-1,1,1,1,1,1,1,1,1,1,1,1,1,1,1,1,1,1,1,1,1,1,1,1,1,1,0.888888889,0.806451613,1
76,219928,Why did you remove those German emigrant cases. Shouldn't we include those cases of people who was born in what was then Germany at the time?#,-2,,,,-6,,,-2,,3,,,,-1,-8,,,,,0,,,,,0,,,,-1,,,,,0,,-4,,,,,-10,,3,,,,,-1,,,-1,,,,-1,1,1,1,-1,1,1,-1,1,1,1,1,1,-1,-1,1,1,1,1,1,1,1,1,1,1,1,1,1,-1,1,1,1,1,1,1,-1,1,1,1,1,-1,1,1,1,1,1,1,-1,1,1,-1,1,1,1,0.62962963,0.612903226,0.652173913
77,394222,just wondering how the chapters were going. you think they are notable enough to have their own article?#,2,,,,-2,,,3,,12,,,,,-7,,,,,0,,,,,-2,,,,5,,,,,-1,,-2,,,,,-7,,-6,,,,,-2,,,-2,,,,1,1,1,1,-1,1,1,1,1,1,1,1,1,1,-1,1,1,1,1,1,1,1,1,1,-1,1,1,1,1,1,1,1,1,-1,1,-1,1,1,1,1,-1,1,-1,1,1,1,1,-1,1,1,-1,1,1,1,0.666666667,0.806451613,0.47826087
78,164799,"What would the recommended sequencing be, then?... Good Article then Feautred Article recommendation?#",-2,,,,0,,,0,,3,,,,0,0,,,,,-1,,,,,-2,,,,1,,,,,-2,,-1,,,,,0,,1,,,,,0,,,-3,,,,-1,1,1,1,1,1,1,1,1,1,1,1,1,1,1,1,1,1,1,-1,1,1,1,1,-1,1,1,1,1,1,1,1,1,-1,1,-1,1,1,1,1,1,1,1,1,1,1,1,1,1,1,-1,1,1,1,0.777777778,0.806451613,0.739130435
79,576947,"I noticed you added the Jean Chretien link to the homepage, which is nice, but you didn't put any comment for the changelog and you also didn't bump of the last article, you bumped off the 2nd last article. Why?#",-6,,,,-5,,,-2,,5,,,,-3,-8,,,,,-8,,,,,-2,,,,2,,,,,2,,-3,,,,,-4,,4,,,,,-1,,,-1,,,,-1,1,1,1,-1,1,1,-1,1,1,1,1,1,-1,-1,1,1,1,1,-1,1,1,1,1,-1,1,1,1,1,1,1,1,1,1,1,-1,1,1,1,1,-1,1,1,1,1,1,1,-1,1,1,-1,1,1,1,0.592592593,0.548387097,0.652173913
80,207737,"In <url>, you removed a cartoon image of Wendy Thomas that had been used in the infobox on her article. I'm not very familiar with the NFCC policy you cite, so I was wondering if you thought that giving a rationale on the image for use in that particular article would bring it up to specs?#",1,,,,7,,,2,,5,,,,1,0,,,,,1,,,,,2,,,,1,,,,,8,,7,,,,,0,,3,,,,,0,,,2,,,,1,1,1,1,1,1,1,1,1,1,1,1,1,1,1,1,1,1,1,1,1,1,1,1,1,1,1,1,1,1,1,1,1,1,1,1,1,1,1,1,1,1,1,1,1,1,1,1,1,1,1,1,1,1,1,1,1
81,628231,"Also, 'topological proof'? Isn't 'proof' a bit strong?#",-5,,,,-2,,,-3,,,,,,-3,,,,,2,0,,,,,,0,,-4,1,,,,,,,-1,,,5,,,,-2,,,,-3,,,,-3,,,,-1,1,1,1,-1,1,1,-1,1,1,1,1,1,-1,1,1,1,1,1,1,1,1,1,1,1,1,1,-1,1,1,1,1,1,1,1,-1,1,1,1,1,1,1,-1,1,1,1,-1,1,1,1,-1,1,1,1,0.666666667,0.677419355,0.652173913
82,625715,"When you say you emailed Crystal, do you mean ''Crystal Evans, AKA Country Girl in Girl Authority?'' She was the one who wanted me to recieve the Barnstar?#",-1,,,,-12,,,2,,,,,,-2,,,,,3,3,,,,,,3,,-2,1,,,,,,,-1,,,-2,,,,0,,,,-5,,,,0,,,,-1,1,1,1,-1,1,1,1,1,1,1,1,1,-1,1,1,1,1,1,1,1,1,1,1,1,1,1,-1,1,1,1,1,1,1,1,-1,1,1,-1,1,1,1,1,1,1,1,-1,1,1,1,1,1,1,1,0.740740741,0.741935484,0.739130435
83,153143,I seem to have stuffed up creating 4 April 2009 very badly. Can you help?#,-11,,,,12,,,3,,,,,,4,,,,,7,2,,,,,,-3,,0,4,,,,,,,-1,,,2,,,,-4,,,,0,,,,0,,,,-1,1,1,1,1,1,1,1,1,1,1,1,1,1,1,1,1,1,1,1,1,1,1,1,1,-1,1,1,1,1,1,1,1,1,1,-1,1,1,1,1,1,1,-1,1,1,1,1,1,1,1,1,1,1,1,0.851851852,0.870967742,0.826086957
84,414976,"Hello. Regarding <url>, could you tell me what supports this being a free image?#",12,,,,7,,,3,,,,,,7,,,,,12,3,,,,,,1,,7,7,,,,,,,0,,,2,,,,1,,,,0,,,,-8,,,,1,1,1,1,1,1,1,1,1,1,1,1,1,1,1,1,1,1,1,1,1,1,1,1,1,1,1,1,1,1,1,1,1,1,1,1,1,1,1,1,1,1,1,1,1,1,1,1,1,1,-1,1,1,1,0.962962963,1,0.913043478
85,234380,"Yes, I do have the Family Guy DVD collection, Volume 1, Seasons 1&2. What's up?#",4,,,,-3,,,-6,,,,,,5,,,,,11,3,,,,,,4,,8,1,,,,,,,-1,,,4,,,,0,,,,-3,,,,-9,,,,1,1,1,1,-1,1,1,-1,1,1,1,1,1,1,1,1,1,1,1,1,1,1,1,1,1,1,1,1,1,1,1,1,1,1,1,-1,1,1,1,1,1,1,1,1,1,1,-1,1,1,1,-1,1,1,1,0.814814815,0.870967742,0.739130435
86,137251,"An editor you recently blocked for a week, <url>, is now editing the same articles and topics under an IP account <url>. Is this allowed or should it just be ignored?#",10,,,,4,,,3,,,,,,2,,,,,8,-1,,,,,,4,,-1,1,,,,,,,5,,,2,,,,0,,,,0,,,,3,,,,1,1,1,1,1,1,1,1,1,1,1,1,1,1,1,1,1,1,1,-1,1,1,1,1,1,1,1,-1,1,1,1,1,1,1,1,1,1,1,1,1,1,1,1,1,1,1,1,1,1,1,1,1,1,1,0.925925926,0.870967742,1
87,627674,"I agree, and that is something that I have believed to be the case for a few weeks now, but <name> won't let me make any significant changes that would result as such. So has it been propsed that the material be merged?#",9,,,,7,,,-2,,,,,,1,,,,,10,6,,,,,,4,,6,6,,,,,,,7,,,2,,,,-10,,,,1,,,,6,,,,1,1,1,1,1,1,1,-1,1,1,1,1,1,1,1,1,1,1,1,1,1,1,1,1,1,1,1,1,1,1,1,1,1,1,1,1,1,1,1,1,1,1,-1,1,1,1,1,1,1,1,1,1,1,1,0.925925926,0.935483871,0.913043478
88,476597,I'm confused: what did you do? And how did you delete it twice without restoring it in between?#,-11,,,,3,,,-4,,,,,,0,,,,,9,-4,,,,,,5,,1,3,,,,,,,-1,,,-4,,,,-6,,,,-3,,,,-5,,,,-1,1,1,1,1,1,1,-1,1,1,1,1,1,1,1,1,1,1,1,-1,1,1,1,1,1,1,1,1,1,1,1,1,1,1,1,-1,1,1,-1,1,1,1,-1,1,1,1,-1,1,1,1,-1,1,1,1,0.703703704,0.806451613,0.565217391
89,516456,<url>. What do you think should be done?#,-1,,,,3,,,0,,,,,,0,,,,,12,-1,,,,,,4,,0,9,,,,,,,4,,,-3,,,,-8,,,,0,,,,0,,,,-1,1,1,1,1,1,1,1,1,1,1,1,1,1,1,1,1,1,1,-1,1,1,1,1,1,1,1,1,1,1,1,1,1,1,1,1,1,1,-1,1,1,1,-1,1,1,1,1,1,1,1,1,1,1,1,0.851851852,0.870967742,0.826086957
90,544688,"This would make a great addition to DYK, you know. (<url> :) It's just under a thousand wordsu2014maybe more of your thesis would like to make it onto WP?#",12,,,6,,,,,,-1,,,,,6,2,,,,,,2,,9,7,,,,,,,2,,,3,,,,4,,,,0,,,,,,,,,,,,1,1,1,1,1,1,1,1,1,-1,1,1,1,1,1,1,1,1,1,1,1,1,1,1,1,1,1,1,1,1,1,1,1,1,1,1,1,1,1,1,1,1,1,1,1,1,1,1,1,1,1,1,1,1,0.962962963,0.935483871,1
91,172545,Iulius! Could you provide exact reference of article u017dirmu016bnai part ''Demographics'' ethnicity composition?#,1,,,,,,2,,,,,0,,,0,,,,,5,,,,1,2,,,,,,,,2,2,,,,,3,,,,,,-3,,,,,,-6,,,,1,1,1,1,1,1,1,1,1,1,1,1,1,1,1,1,1,1,1,1,1,1,1,1,1,1,1,1,1,1,1,1,1,1,1,1,1,1,1,1,1,1,1,1,-1,1,1,1,1,1,-1,1,1,1,0.925925926,1,0.826086957
92,71974,The race was advertised and billed as the 100th Indy 500. Are you saying the promoters and Indycar are liars?#,-5,,,,,-9,-6,,,,,-3,,,-3,,,,,-10,,,,-5,-3,,,,,,,,0,-2,,,,,-5,,,,,,-12,-6,,,,,-6,,,,-1,1,1,1,1,-1,-1,1,1,1,1,-1,1,1,-1,1,1,1,1,-1,1,1,1,-1,-1,1,1,1,1,1,1,1,1,-1,1,1,1,1,-1,1,1,1,1,1,-1,-1,1,1,1,1,-1,1,1,1,0.518518519,0.483870968,0.565217391
93,447985,"As a timid Wikipedia end-user who never makes more than a rare grammatical or spelling edit, learning the history to be found on this talk page and Kate's userpage history makes me sad. Why is it that so many communities change the way they do as the size of the project they revolve around increases..?#",-1,,,,,0,5,,,,,-3,,,0,,,,,6,,,,-2,6,,,,,,,,5,-1,,,,,0,,,,,,0,4,,,,,0,,,,-1,1,1,1,1,1,1,1,1,1,1,-1,1,1,1,1,1,1,1,1,1,1,1,-1,1,1,1,1,1,1,1,1,1,-1,1,1,1,1,1,1,1,1,1,1,1,1,1,1,1,1,1,1,1,1,0.851851852,0.806451613,0.913043478
94,537248,Title says it all.<url> I dont have time to put up a page... but might I suggest <url>?#,2,,,,,-12,-3,,,,,-2,,,2,,,,,0,,,,-3,0,,,,,,,,3,0,,,,,3,,,,,,3,4,,,,,-1,,,,1,1,1,1,1,-1,-1,1,1,1,1,-1,1,1,1,1,1,1,1,1,1,1,1,-1,1,1,1,1,1,1,1,1,1,1,1,1,1,1,1,1,1,1,1,1,1,1,1,1,1,1,-1,1,1,1,0.814814815,0.741935484,0.913043478
95,6478,Thanks. Do you happen to know if the postcard was origianlly published in Japan?#,3,,,,,3,6,,,,,7,,,4,,,,,8,,,,8,8,,,,,,,,2,10,,,,,6,,,,,,9,3,,,,,6,,,,1,1,1,1,1,1,1,1,1,1,1,1,1,1,1,1,1,1,1,1,1,1,1,1,1,1,1,1,1,1,1,1,1,1,1,1,1,1,1,1,1,1,1,1,1,1,1,1,1,1,1,1,1,1,1,1,1
96,13280,"Sorry, but which talk page? I came across the graphic at <url> - is there another?#",3,,,,,-1,6,,,,,3,,,4,,,,,10,,,,7,5,,,,,,,,0,4,,,,,7,,,,,,0,5,,,,,3,,,,1,1,1,1,1,-1,1,1,1,1,1,1,1,1,1,1,1,1,1,1,1,1,1,1,1,1,1,1,1,1,1,1,1,1,1,1,1,1,1,1,1,1,1,1,1,1,1,1,1,1,1,1,1,1,0.962962963,0.935483871,1
97,599609,So....what's up with this article? Is it a joke?#,-8,,,,,-12,-5,,,,,-7,,,-5,,,,,-8,,,,-6,-5,,,,,,,,0,-1,,,,,-6,,,,,,-6,-11,,,,,-8,,,,-1,1,1,1,1,-1,-1,1,1,1,1,-1,1,1,-1,1,1,1,1,-1,1,1,1,-1,-1,1,1,1,1,1,1,1,1,-1,1,1,1,1,-1,1,1,1,1,1,-1,-1,1,1,1,1,-1,1,1,1,0.518518519,0.483870968,0.565217391
98,532224,The content has recently been added to <url>. Would you consider changing your vote to delete?#,5,,,,,10,-2,,,,,0,,,6,,,,,-1,,,,4,7,,,,,,,,2,2,,,,,3,,,,,,9,4,,,,,0,,,,1,1,1,1,1,1,-1,1,1,1,1,1,1,1,1,1,1,1,1,-1,1,1,1,1,1,1,1,1,1,1,1,1,1,1,1,1,1,1,1,1,1,1,1,1,1,1,1,1,1,1,1,1,1,1,0.925925926,0.870967742,1
99,629673,No problem. Have you heard anything new about HRE?#,5,,,,,6,5,,,,,5,,,5,,,,,10,,,,4,7,,,,,,,,1,4,,,,,6,,,,,,9,4,,,,,3,,,,1,1,1,1,1,1,1,1,1,1,1,1,1,1,1,1,1,1,1,1,1,1,1,1,1,1,1,1,1,1,1,1,1,1,1,1,1,1,1,1,1,1,1,1,1,1,1,1,1,1,1,1,1,1,1,1,1
100,334732,"Again samething with the second site, again outside of taking they're word for it how do we know they are are right. What is your opinion on the 2 logos in the forum discussion think they were made up?#",4,,,,,-6,2,,,,,-2,,,0,,,,,-11,,,,5,-1,,,,,,,,0,0,,,,,0,,,,,,-8,-7,,,,,0,,,,1,1,1,1,1,-1,1,1,1,1,1,-1,1,1,1,1,1,1,1,-1,1,1,1,1,-1,1,1,1,1,1,1,1,1,1,1,1,1,1,1,1,1,1,1,1,-1,-1,1,1,1,1,1,1,1,1,0.777777778,0.741935484,0.826086957
101,626770,"Your poorly written, bizarre comment makes no sense, since all of my edits in the Al Franken article conform to wikipedia's NPOV policy. What are you talking about?#",-9,,,,,,,,,-11,,,-12,-12,,,,,,-12,-10,,,,,,-6,,,,,0,,,,-11,,,-12,,,,,,-12,,,-10,,-5,,,,,-1,1,1,1,1,1,1,1,1,-1,1,1,-1,-1,1,1,1,1,1,-1,-1,1,1,1,1,1,-1,1,1,1,1,1,1,1,1,-1,1,1,-1,1,1,1,1,1,-1,1,1,-1,1,-1,1,1,1,1,0.555555556,0.548387097,0.565217391
102,459747,Howdy Resolute. Is <url> for real?#,-6,,,,,,,,,-5,,,6,-12,,,,,,4,4,,,,,,-7,,,,,6,,,,0,,,-3,,,,,,0,,,-1,,3,,,,,-1,1,1,1,1,1,1,1,1,-1,1,1,1,-1,1,1,1,1,1,1,1,1,1,1,1,1,-1,1,1,1,1,1,1,1,1,1,1,1,-1,1,1,1,1,1,1,1,1,-1,1,1,1,1,1,1,0.777777778,0.741935484,0.826086957
103,102225,"I just reverted your addition of a fossil range template to <url>, because with only an arrow at the very right it didn't seem to add much useful information. Perhaps we could make a separate template to show only the Cenozoic or so, which would allow us to show more detail in these fossil ranges?#",7,,,,,,,,,8,,,1,-2,,,,,,3,4,,,,,,4,,,,,-6,,,,3,,,5,,,,,,12,,,3,,6,,,,,1,1,1,1,1,1,1,1,1,1,1,1,1,-1,1,1,1,1,1,1,1,1,1,1,1,1,1,1,1,1,1,-1,1,1,1,1,1,1,1,1,1,1,1,1,1,1,1,1,1,1,1,1,1,1,0.925925926,0.935483871,0.913043478
104,399040,That's making the fundamental assertion that the second source is reliable. Can you prove that it is?#,1,,,,,,,,,-2,,,0,-3,,,,,,-5,0,,,,,,0,,,,,4,,,,-1,,,3,,,,,,6,,,-1,,0,,,,,1,1,1,1,1,1,1,1,1,-1,1,1,1,-1,1,1,1,1,1,-1,1,1,1,1,1,1,1,1,1,1,1,1,1,1,1,-1,1,1,1,1,1,1,1,1,1,1,1,-1,1,1,1,1,1,1,0.814814815,0.806451613,0.826086957
105,620486,? What?#,,,,-3,,,,,,,,,-6,,,-5,-12,,,,,,-9,-2,,,,,,-9,,,,,-10,,,,-2,,,-12,,,,,,-9,,,-3,,0,,1,1,1,-1,1,1,1,1,1,1,1,1,-1,1,1,-1,-1,1,1,1,1,1,-1,-1,1,1,1,1,1,-1,1,1,1,1,-1,1,1,1,-1,1,1,-1,1,1,1,1,1,-1,1,1,-1,1,1,1,0.555555556,0.548387097,0.565217391
106,71828,"There seems to have been something wrong with the pages you made on the V8 Supercar Championship Series - a glitch with the ""align"" tags in the beginning infobox made the text grotesquely overflow the margins. I've trimmed these down; mind checking my work?#",7,,,,,,,,,7,,,0,-1,,,,,,-3,3,,,,,,3,,,,,3,,,,1,,,2,,,,,,12,,,0,,3,,,,,1,1,1,1,1,1,1,1,1,1,1,1,1,-1,1,1,1,1,1,-1,1,1,1,1,1,1,1,1,1,1,1,1,1,1,1,1,1,1,1,1,1,1,1,1,1,1,1,1,1,1,1,1,1,1,0.925925926,0.870967742,1
107,475979,"Some links look notable, others do not, <url>. Thoughts?#",3,,,,,,,,,9,,,7,-4,,,,,,-1,3,,,,,,5,,,,,6,,,,2,,,0,,,,,,6,,,-1,,3,,,,,1,1,1,1,1,1,1,1,1,1,1,1,1,-1,1,1,1,1,1,-1,1,1,1,1,1,1,1,1,1,1,1,1,1,1,1,1,1,1,1,1,1,1,1,1,1,1,1,-1,1,1,1,1,1,1,0.888888889,0.870967742,0.913043478
108,532687,You might be just the person I need- <url> has just been repeatedly vandalised and with ? German - in there - wonder what you would do with the vandal?#,4,,,,,,,,,6,,,7,-2,,,,,,3,4,,,,,,2,,,,,-6,,,,2,,,-6,,,,,,3,,,-1,,4,,,,,1,1,1,1,1,1,1,1,1,1,1,1,1,-1,1,1,1,1,1,1,1,1,1,1,1,1,1,1,1,1,1,-1,1,1,1,1,1,1,-1,1,1,1,1,1,1,1,1,-1,1,1,1,1,1,1,0.851851852,0.935483871,0.739130435
109,500692,"Hello, I know that the article <url> isn't exactly football related, but can you help out on <url>? and tell me if the article is ready for a GA nominee?#",4,,,,,,,,,11,,,6,-1,,,,,,5,2,,,,,,4,,,,,1,,,,2,,,6,,,,,,6,,,-1,,0,,,,,1,1,1,1,1,1,1,1,1,1,1,1,1,-1,1,1,1,1,1,1,1,1,1,1,1,1,1,1,1,1,1,1,1,1,1,1,1,1,1,1,1,1,1,1,1,1,1,-1,1,1,1,1,1,1,0.925925926,0.935483871,0.913043478
110,303013,Based on what? Don't you think a little discussion is in order before doing this?#,-3,,,,,,,,,-8,,,-4,-12,,,,,,-12,-1,,,,,,-3,,,,,4,,,,-3,,,-3,,,,,,-12,,,-3,,-5,,,,,-1,1,1,1,1,1,1,1,1,-1,1,1,-1,-1,1,1,1,1,1,-1,-1,1,1,1,1,1,-1,1,1,1,1,1,1,1,1,-1,1,1,-1,1,1,1,1,1,-1,1,1,-1,1,-1,1,1,1,1,0.555555556,0.548387097,0.565217391
111,300945,I tried to fix your problem with <url>. Is that what you were looking for?#,9,,,,,,8,,0,,,12,,,1,,0,,,-8,,,,,3,,,,,,1,,,,,0,,-2,,,,4,,,,,,6,,,,0,,,1,1,1,1,1,1,1,1,1,1,1,1,1,1,1,1,1,1,1,-1,1,1,1,1,1,1,1,1,1,1,1,1,1,1,1,1,1,-1,1,1,1,1,1,1,1,1,1,1,1,1,1,1,1,1,0.925925926,0.935483871,0.913043478
112,475912,I was really unsure on what to do with <url> so I made it into a dab. That ok?#,-1,,,,,,7,,-5,,,5,,,-1,,-6,,,0,,,,,4,,,,,,0,,,,,-1,,-2,,,,2,,,,,,6,,,,3,,,-1,1,1,1,1,1,1,1,-1,1,1,1,1,1,-1,1,-1,1,1,1,1,1,1,1,1,1,1,1,1,1,1,1,1,1,1,-1,1,-1,1,1,1,1,1,1,1,1,1,1,1,1,1,1,1,1,0.777777778,0.741935484,0.826086957
113,520796,What do you think? Perhaps the coat of arms field can contain the picture that the article's family name infobox already has?#,10,,,,,,6,,3,,,8,,,1,,1,,,1,,,,,7,,,,,,5,,,,,0,,8,,,,3,,,,,,9,,,,5,,,1,1,1,1,1,1,1,1,1,1,1,1,1,1,1,1,1,1,1,1,1,1,1,1,1,1,1,1,1,1,1,1,1,1,1,1,1,1,1,1,1,1,1,1,1,1,1,1,1,1,1,1,1,1,1,1,1
114,343273,"I consider <url> to be the single most important edit I have ever made. God, what is happening with The Beatles coverage on Wikipedia?#",-6,,,,,,-3,,-6,,,5,,,-2,,-3,,,0,,,,,0,,,,,,2,,,,,0,,0,,,,-3,,,,,,0,,,,1,,,-1,1,1,1,1,1,-1,1,-1,1,1,1,1,1,-1,1,-1,1,1,1,1,1,1,1,1,1,1,1,1,1,1,1,1,1,1,1,1,1,1,1,1,-1,1,1,1,1,1,1,1,1,1,1,1,1,0.777777778,0.677419355,0.913043478
115,397759,I find it hard to believe one editor (even one so prolific as RickK) can have much of an effect overall. Do contributors on either side have any (non-anecdotal) evidence that suggests otherwise?#,6,,,,,,1,,-10,,,2,,,-2,,-5,,,-2,,,,,3,,,,,,4,,,,,5,,1,,,,-2,,,,,,0,,,,5,,,1,1,1,1,1,1,1,1,-1,1,1,1,1,1,-1,1,-1,1,1,-1,1,1,1,1,1,1,1,1,1,1,1,1,1,1,1,1,1,1,1,1,1,-1,1,1,1,1,1,1,1,1,1,1,1,1,0.814814815,0.741935484,0.913043478
116,235522,Which discussion are you referring to? On which article's talk page?#,3,,,,,,0,,3,,,12,,,0,,-4,,,-4,,,,,4,,,,,,0,,,,,4,,-2,,,,0,,,,,,0,,,,0,,,1,1,1,1,1,1,1,1,1,1,1,1,1,1,1,1,-1,1,1,-1,1,1,1,1,1,1,1,1,1,1,1,1,1,1,1,1,1,-1,1,1,1,1,1,1,1,1,1,1,1,1,1,1,1,1,0.888888889,0.870967742,0.913043478
117,464868,"Hi, I recently got approval for your requested link replacement (sorry for the delay), but, after doing a <url> there seems to be very few links left to replace. Could you confirm the problem is solved?#",12,,,,,,7,,6,,,12,,,5,,2,,,5,,,,,4,,,,,,3,,,,,3,,10,,,,7,,,,,,12,,,,4,,,1,1,1,1,1,1,1,1,1,1,1,1,1,1,1,1,1,1,1,1,1,1,1,1,1,1,1,1,1,1,1,1,1,1,1,1,1,1,1,1,1,1,1,1,1,1,1,1,1,1,1,1,1,1,1,1,1
118,337509,The Olbermann thing is being discussed on the <url> talk page. Do you have anything to add?#,9,,,,,,5,,-4,,,12,,,5,,-1,,,5,,,,,4,,,,,,3,,,,,2,,1,,,,0,,,,,,3,,,,1,,,1,1,1,1,1,1,1,1,-1,1,1,1,1,1,1,1,-1,1,1,1,1,1,1,1,1,1,1,1,1,1,1,1,1,1,1,1,1,1,1,1,1,1,1,1,1,1,1,1,1,1,1,1,1,1,0.925925926,0.870967742,1
119,626197,REVERT???#,-12,,,,,,-6,,-12,,,0,,,-8,,-11,,,0,,,,,,,,,,,-5,,,,,-5,,-8,,,,-9,,,,,,-9,,,,-8,,,-1,1,1,1,1,1,-1,1,-1,1,1,1,1,1,-1,1,-1,1,1,1,1,1,1,1,1,1,1,1,1,1,-1,1,1,1,1,-1,1,-1,1,1,1,-1,1,1,1,1,1,-1,1,1,1,-1,1,1,0.592592593,0.612903226,0.565217391
120,72763,"I started, but gave up. And why link the word 'mother'?#",-4,,,,,,3,,-10,,,3,,,-3,,-12,,,-5,,,,,-1,,,,,,-2,,,,,-1,,-3,,,,-6,,,,,,-9,,,,-9,,,-1,1,1,1,1,1,1,1,-1,1,1,1,1,1,-1,1,-1,1,1,-1,1,1,1,1,-1,1,1,1,1,1,-1,1,1,1,1,-1,1,-1,1,1,1,-1,1,1,1,1,1,-1,1,1,1,-1,1,1,0.555555556,0.548387097,0.565217391
121,283735,"So how are u gonna concider weither the licences used by Fluckr are accurate...? ,and if this image has to bee conciderd than Image:Petercrouch_liverpool.JPG should be to..?#",-11,,,-5,,,-1,,,,11,,,,-1,,,0,,,-2,,,,,,,1,,-3,,,0,,,,-6,,,0,,,,,3,,,,,,1,,-4,,-1,1,1,-1,1,1,-1,1,1,1,1,1,1,1,-1,1,1,1,1,1,-1,1,1,1,1,1,1,1,1,-1,1,1,1,1,1,1,-1,1,1,1,1,1,1,1,1,1,1,1,1,1,1,1,-1,1,0.703703704,0.612903226,0.826086957
122,524373,"AnonEMouse, I have noticed today that there are many recent comments on the <url> talk page that do not show in ""history"". How can that happen?#",-1,,,0,,,1,,,,4,,,,0,,,0,,,-6,,,,,,,6,,7,,,-3,,,,0,,,-1,,,,,0,,,,,,3,,-1,,-1,1,1,1,1,1,1,1,1,1,1,1,1,1,1,1,1,1,1,1,-1,1,1,1,1,1,1,1,1,1,1,1,-1,1,1,1,1,1,1,-1,1,1,1,1,1,1,1,1,1,1,1,1,-1,1,0.814814815,0.870967742,0.739130435
123,25727,"It turns out that the Zelda Collection you referred to in <url> didn't include aLttP, reportedly because the GBA remake was still being sold at that time, so that disc included NES and N64 emulation but left out SNES. Do you have another example?#",4,,,6,,,2,,,,,,,,3,,,0,,,12,,,,,,,3,,6,,,-1,,,,1,,,1,,,,,3,,,,,,2,,-2,,1,1,1,1,1,1,1,1,1,1,1,1,1,1,1,1,1,1,1,1,1,1,1,1,1,1,1,1,1,1,1,1,-1,1,1,1,1,1,1,1,1,1,1,1,1,1,1,1,1,1,1,1,-1,1,0.925925926,1,0.826086957
124,629591,I just did some edits on it. Feedback?#,-10,,,5,,,4,,,,7,,,,4,,,9,,,-3,,,,,,,-1,,6,,,0,,,,-4,,,-1,,,,,3,,,,,,-6,,-2,,-1,1,1,1,1,1,1,1,1,1,1,1,1,1,1,1,1,1,1,1,-1,1,1,1,1,1,1,-1,1,1,1,1,1,1,1,1,-1,1,1,-1,1,1,1,1,1,1,1,1,1,1,-1,1,-1,1,0.740740741,0.806451613,0.652173913
125,184558,"That looks better. I think I'm about done now, but old Theobald's still at Featured Article candidates isn't he?#",-6,,,9,,,1,,,,2,,,,1,,,9,,,-2,,,,,,,0,,6,,,0,,,,0,,,0,,,,,3,,,,,,-4,,1,,-1,1,1,1,1,1,1,1,1,1,1,1,1,1,1,1,1,1,1,1,-1,1,1,1,1,1,1,1,1,1,1,1,1,1,1,1,1,1,1,1,1,1,1,1,1,1,1,1,1,1,-1,1,1,1,0.888888889,0.870967742,0.913043478
126,626716,"Even worse: ""The authorized use of this data is limited to informational and educational purposes only, and NOT for operational or commercial purposes."" This clearly disqualifies the text for Wikipedia purposes, I'm afraid we'll have to delete the article. Do you know of any similar contributions you've made?#",-3,,,4,,,-5,,,,1,,,,1,,,0,,,-1,,,,,,,3,,6,,,-3,,,,1,,,-1,,,,,3,,,,,,1,,-6,,-1,1,1,1,1,1,-1,1,1,1,1,1,1,1,1,1,1,1,1,1,-1,1,1,1,1,1,1,1,1,1,1,1,-1,1,1,1,1,1,1,-1,1,1,1,1,1,1,1,1,1,1,1,1,-1,1,0.777777778,0.806451613,0.739130435
127,30722,You added to the Order of Victoria and Albert page that no awards were given out after the death of Queen Victoria. According to the <url> she became the tSovereign of the Order in 1952. Is this just because the order was never officially scrapped ?#,-6,,,6,,,-5,,,,9,,,,1,,,0,,,2,,,,,,,0,,5,,,0,,,,-1,,,0,,,,,3,,,,,,-2,,-3,,-1,1,1,1,1,1,-1,1,1,1,1,1,1,1,1,1,1,1,1,1,1,1,1,1,1,1,1,1,1,1,1,1,1,1,1,1,-1,1,1,1,1,1,1,1,1,1,1,1,1,1,-1,1,-1,1,0.814814815,0.870967742,0.739130435
128,392689,As you can tell from my user page I do like art. I noticed you talking about a film ambassador on WikiProject Film (An project that I am active on) and I was wondering what is the main goals of film ambassador?#,-2,,,5,,,7,,,,3,,,,,,,7,,,0,,,,,,,1,,5,,,6,,,,2,,,3,,,,,0,,,,,,3,,4,,-1,1,1,1,1,1,1,1,1,1,1,1,1,1,1,1,1,1,1,1,1,1,1,1,1,1,1,1,1,1,1,1,1,1,1,1,1,1,1,1,1,1,1,1,1,1,1,1,1,1,1,1,1,1,0.962962963,0.935483871,1
129,404995,I noticed that you are the major contributor to the articles. Mind if I nominate <url> at <url>?#,4,,,7,,,7,,,,12,,,,6,,,3,,,,,,,,,,1,,7,,,0,,,,4,,,3,,,,,1,,,,,,3,,5,,1,1,1,1,1,1,1,1,1,1,1,1,1,1,1,1,1,1,1,1,1,1,1,1,1,1,1,1,1,1,1,1,1,1,1,1,1,1,1,1,1,1,1,1,1,1,1,1,1,1,1,1,1,1,1,1,1
130,297846,Would my doing a read-through looking out for that kind of thing be useful? Or would it be merely annoying?#,0,,,3,,,2,,,,9,,,,4,,,5,,,-8,,,,,,,2,,8,,,12,,,,3,,,-4,,,,,4,,,,,,-1,,3,,1,1,1,1,1,1,1,1,1,1,1,1,1,1,1,1,1,1,1,1,-1,1,1,1,1,1,1,1,1,1,1,1,1,1,1,1,1,1,1,-1,1,1,1,1,1,1,1,1,1,1,-1,1,1,1,0.888888889,0.935483871,0.826086957
131,292769,What would that do? Is that good?#,,,-4,,,,-4,,,,,,-1,,,0,,-1,,,,4,0,,,0,,,,,0,,,-1,,,,0,,,,,6,,,-3,,,-5,,,,,,1,1,-1,1,1,1,-1,1,1,1,1,1,-1,1,1,1,1,-1,1,1,1,1,1,1,1,1,1,1,1,1,1,1,1,-1,1,1,1,1,1,1,1,1,1,1,1,-1,1,1,-1,1,1,1,1,1,0.740740741,0.741935484,0.739130435
132,621555,"Creating and improving images, or just placing them in articles/making sure they have the right copyrights/etc.?#",0,,,,0,,,,,,,,,1,,-1,,,,0,0,,,1,,,,,0,,,-2,,,,0,,,,,0,,,3,,,-4,,,,,,,,1,1,1,1,1,1,1,1,1,1,1,1,1,1,1,-1,1,1,1,1,1,1,1,1,1,1,1,1,1,1,1,-1,1,1,1,1,1,1,1,1,1,1,1,1,1,1,-1,1,1,1,1,1,1,1,0.888888889,0.935483871,0.826086957
133,378972,"Your DYK hook for <url> is missing something. It says ""''Frank Bancroft managed the now-defunct Major League Baseball Providence Grays...''"" - maybe ""'''his''' now-defunct Major League Baseball '''team, the''' Providence Grays,...""?#",0,,,,2,,,,,,-2,,,0,,0,,,,0,1,,,3,,,,,-3,,,-3,,,,0,,,,,3,,,-1,,,-1,,,,,,,,1,1,1,1,1,1,1,1,1,1,-1,1,1,1,1,1,1,1,1,1,1,1,1,1,1,1,1,1,-1,1,1,-1,1,1,1,1,1,1,1,1,1,1,1,-1,1,1,-1,1,1,1,1,1,1,1,0.814814815,0.870967742,0.739130435
134,625006,"Yes, ''kaen chokugeki hou'' is exactly right. Do you have that same NTSC Hong Kong DVD that I do?#",2,,,,5,,,,,,1,,,3,,1,,,,3,3,,,8,,,,,0,,,0,,,,2,,,,,0,,,0,,,2,,,,,,,,1,1,1,1,1,1,1,1,1,1,1,1,1,1,1,1,1,1,1,1,1,1,1,1,1,1,1,1,1,1,1,1,1,1,1,1,1,1,1,1,1,1,1,1,1,1,1,1,1,1,1,1,1,1,1,1,1
135,490623,I'll also add some categories to cover the collaboration nomination procedure and we should think about setting up a project <url>. Can you think of anything else that we need to tag that could be better handled through the comicsproj template than a banner on the front page?#,6,,,,6,,,,,,1,,,11,,1,,,,4,5,,,11,,,,,9,,,2,,,,2,,,,,6,,,6,,,8,,,,,,,,1,1,1,1,1,1,1,1,1,1,1,1,1,1,1,1,1,1,1,1,1,1,1,1,1,1,1,1,1,1,1,1,1,1,1,1,1,1,1,1,1,1,1,1,1,1,1,1,1,1,1,1,1,1,1,1,1
136,557002,One oddity is that the Library of Congress isn't officially the U.S. national library; there are only national libraries in Medicine and Agriculture. Do you compare specialized libraries?#,3,,,,0,,,,,,,,,6,,1,,,,0,3,,,4,,,,,0,,,2,,,,1,,,,,0,,,0,,,4,,,,,,,,1,1,1,1,1,1,1,1,1,1,1,1,1,1,1,1,1,1,1,1,1,1,1,1,1,1,1,1,1,1,1,1,1,1,1,1,1,1,1,1,1,1,1,1,1,1,1,1,1,1,1,1,1,1,1,1,1
137,621427,"I don't think so, <name>. Can we just once attempt to let this pass by without calling for the heads of people?#",-6,,,,-4,,,,,,-10,,,3,,-3,,,,-3,6,,,-1,,,,,-10,,,-1,,,,-1,,,,,0,,,3,,,1,,,,,,,,-1,1,1,1,-1,1,1,1,1,1,-1,1,1,1,1,-1,1,1,1,-1,1,1,1,-1,1,1,1,1,-1,1,1,-1,1,1,1,-1,1,1,1,1,1,1,1,1,1,1,1,1,1,1,1,1,1,1,0.666666667,0.548387097,0.826086957
138,198022,"Senta.jpg was garbled or empty or some such, so I deleted it. You might want to try re-uploading?#",-2,,,,3,,,,,,-6,,,2,,-2,,,,-1,3,,,0,,,,,1,,,-4,,,,-1,,,,,3,,,-1,,,5,,,,,,,,-1,1,1,1,1,1,1,1,1,1,-1,1,1,1,1,-1,1,1,1,-1,1,1,1,1,1,1,1,1,1,1,1,-1,1,1,1,-1,1,1,1,1,1,1,1,-1,1,1,1,1,1,1,1,1,1,1,0.740740741,0.741935484,0.739130435
139,607112,"It's probably a bit late to be asking this, but why did you dispute the factual accuracy of the page <url>? Also, why was no mention of the nature of the dispute made anywhere?#",-2,,,,-3,,,,,,-7,,,0,,-2,,,,0,5,,,3,,,,,0,,,-3,,,,0,,,,,3,,,-6,,,6,,,,,,,,-1,1,1,1,-1,1,1,1,1,1,-1,1,1,1,1,-1,1,1,1,1,1,1,1,1,1,1,1,1,1,1,1,-1,1,1,1,1,1,1,1,1,1,1,1,-1,1,1,1,1,1,1,1,1,1,1,0.777777778,0.741935484,0.826086957
140,619630,"Do you know how to make the 'All Star Template' appear only at the bottom, as well as the 'Confirmed future sites', so the actual table appears at the top of the page??#",5,,,,2,,,,,,2,,,8,,-5,,,,0,3,,,4,,,,,0,,,0,,,,0,,,,,3,,,3,,,-1,,,,,,,,1,1,1,1,1,1,1,1,1,1,1,1,1,1,1,-1,1,1,1,1,1,1,1,1,1,1,1,1,1,1,1,1,1,1,1,1,1,1,1,1,1,1,1,1,1,1,-1,1,1,1,1,1,1,1,0.925925926,0.935483871,0.913043478
141,522923,"Just letting you know (since you have mentioned AFDing <url>) that weu2019ve gone to some effort to establish notability with <url>, and have added three reliable, notable, third-party sources to the article. Do you feel these sources establish <url> as being notable (<url> and all that)?#",4,,,0,,,-5,,,,,9,,,7,,,,,,,,7,,,5,,,,,0,,,,2,,,,,1,,5,,,,0,,,,0,,,,,1,1,1,1,1,1,-1,1,1,1,1,1,1,1,1,1,1,1,1,1,1,1,1,1,1,1,1,1,1,1,1,1,1,1,1,1,1,1,1,1,1,1,1,1,1,1,1,1,1,1,1,1,1,1,0.962962963,0.935483871,1
142,164112,"Hi, you've done a lot of work on comparing Featured Article country articles. Are you aware of any country that got special praise for the selection of images in the article?#",4,,,5,,,1,,,,,11,,,12,,,2,,,,,6,,,2,,,,,4,,,,3,,,,,4,,3,,,,0,,,,-1,,,,,1,1,1,1,1,1,1,1,1,1,1,1,1,1,1,1,1,1,1,1,1,1,1,1,1,1,1,1,1,1,1,1,1,1,1,1,1,1,1,1,1,1,1,1,1,1,1,1,1,-1,1,1,1,1,0.962962963,1,0.913043478
